{"agent_id":"agent_1","available_insight_ids":["INS-003","INS-004","INS-005","INS-006","INS-007","INS-008"],"block_index":73,"condition":"B","cumulative_input_tokens":2302,"cumulative_output_tokens":135,"cumulative_total_tokens":2437,"input_hash":"fdeaf8689d66dc3ec91b08802ed069c13b4fde7f0c6772c3e869fdfce3599e19","input_tokens":2302,"max_output_tokens":512,"max_structural_retries":2,"output_tokens":135,"parse_failure":false,"parsed_final_output":{"abstain":false,"predicted_label":"CLS-ZOGAA","reasoning_summary":"Il caso corrisponde quasi esattamente agli esempi locali EXM-001 e EXM-002: spostamento persistente positivo di XMEAS-1, pendenza in 5/8 finestre, residual su XMEAS-20 in 4/8 e diff su XMEAS-10 in 1/8. La dispersione massima su XMEAS-1 (~46.25) conferma il pattern CLS-ZOGAA.","used_insight_ids":[]},"physical_case_id":"EXP3V2-F1-001","position_in_block":1,"previous_response_id_used":false,"prompt_character_count":7228,"prompt_hash":"aac8c9f5bf17963b33e85afd01463f11356475a8bcbafbdd8689b3185e3e3310","provider_attempts":[{"attempt":1,"intent_path":"request_journal/0219.attempt-1.intent.json","response":{"api_family":"Responses API","endpoint":"/v1/responses","input_tokens":2302,"output_tokens":135,"raw_output":"{\"predicted_label\":\"CLS-ZOGAA\",\"abstain\":false,\"used_insight_ids\":[],\"reasoning_summary\":\"Il caso corrisponde quasi esattamente agli esempi locali EXM-001 e EXM-002: spostamento persistente positivo di XMEAS-1, pendenza in 5/8 finestre, residual su XMEAS-20 in 4/8 e diff su XMEAS-10 in 1/8. La dispersione massima su XMEAS-1 (~46.25) conferma il pattern CLS-ZOGAA.\"}","request_id":"req_483b3fc03f5648ea94f1fea09b73e6dc","requested_model":"gpt-5.6-terra","response_id":"resp_0fc974ea101492c7016a9ad026412087d2aee11f10002284f6","response_raw":{"background":false,"billing":{"payer":"developer"},"completed_at":1788530728.0,"conversation":null,"created_at":1788530726.0,"error":null,"frequency_penalty":0.0,"id":"resp_0fc974ea101492c7016a9ad026412087d2aee11f10002284f6","incomplete_details":null,"instructions":null,"max_output_tokens":512,"max_tool_calls":null,"metadata":{},"model":"gpt-5.6-terra","moderation":null,"object":"response","output":[{"content":[{"annotations":[],"logprobs":[],"text":"{\"predicted_label\":\"CLS-ZOGAA\",\"abstain\":false,\"used_insight_ids\":[],\"reasoning_summary\":\"Il caso corrisponde quasi esattamente agli esempi locali EXM-001 e EXM-002: spostamento persistente positivo di XMEAS-1, pendenza in 5/8 finestre, residual su XMEAS-20 in 4/8 e diff su XMEAS-10 in 1/8. La dispersione massima su XMEAS-1 (~46.25) conferma il pattern CLS-ZOGAA.\"}","type":"output_text"}],"id":"msg_0fc974ea101492c7016a9ad026f08487d2b01c388472915ba3","phase":"final_answer","role":"assistant","status":"completed","type":"message"}],"parallel_tool_calls":true,"presence_penalty":0.0,"previous_response_id":null,"prompt":null,"prompt_cache_key":null,"prompt_cache_options":null,"prompt_cache_retention":"24h","reasoning":{"context":"all_turns","effort":"medium","generate_summary":null,"mode":"standard","summary":null},"safety_identifier":null,"service_tier":"default","status":"completed","store":false,"temperature":1.0,"text":{"format":{"description":null,"name":"phase_b_diagnostic_output","schema_":{"additionalProperties":false,"properties":{"abstain":{"type":"boolean"},"predicted_label":{"type":["string","null"]},"reasoning_summary":{"minLength":1,"type":"string"},"used_insight_ids":{"items":{"type":"string"},"type":"array"}},"required":["predicted_label","abstain","used_insight_ids","reasoning_summary"],"title":"Phase B diagnostic output (OpenAI Structured Outputs)","type":"object"},"strict":true,"type":"json_schema"},"verbosity":"medium"},"tool_choice":"auto","tool_usage":{"image_gen":{"input_tokens":0,"input_tokens_details":{"image_tokens":0,"text_tokens":0},"output_tokens":0,"output_tokens_details":{"image_tokens":0,"text_tokens":0},"total_tokens":0},"web_search":{"num_requests":0}},"tools":[],"top_logprobs":0,"top_p":0.98,"truncation":"disabled","usage":{"compute_units":null,"input_tokens":2302,"input_tokens_details":{"cache_write_tokens":0,"cached_tokens":2299},"output_tokens":135,"output_tokens_details":{"reasoning_tokens":0},"total_tokens":2437},"user":null},"returned_model":"gpt-5.6-terra","sdk_version":"3.6.0","total_tokens":2437,"usage_raw":{"compute_units":null,"input_tokens":2302,"input_tokens_details":{"cache_write_tokens":0,"cached_tokens":2299},"output_tokens":135,"output_tokens_details":{"reasoning_tokens":0},"total_tokens":2437}},"response_path":"request_journal/0219.attempt-1.response.json"}],"raw_attempts":["{\"predicted_label\":\"CLS-ZOGAA\",\"abstain\":false,\"used_insight_ids\":[],\"reasoning_summary\":\"Il caso corrisponde quasi esattamente agli esempi locali EXM-001 e EXM-002: spostamento persistente positivo di XMEAS-1, pendenza in 5/8 finestre, residual su XMEAS-20 in 4/8 e diff su XMEAS-10 in 1/8. La dispersione massima su XMEAS-1 (~46.25) conferma il pattern CLS-ZOGAA.\"}"],"raw_output":"{\"predicted_label\":\"CLS-ZOGAA\",\"abstain\":false,\"used_insight_ids\":[],\"reasoning_summary\":\"Il caso corrisponde quasi esattamente agli esempi locali EXM-001 e EXM-002: spostamento persistente positivo di XMEAS-1, pendenza in 5/8 finestre, residual su XMEAS-20 in 4/8 e diff su XMEAS-10 in 1/8. La dispersione massima su XMEAS-1 (~46.25) conferma il pattern CLS-ZOGAA.\"}","reasoning_effort":"medium","repetition":2,"requested_model":"gpt-5.6-terra","retry_count":0,"returned_model":"gpt-5.6-terra","seed":null,"sequence_index":219,"stateless":true,"store":false,"structural_validation_errors":[],"structured_outputs_strict":true,"temperature":null,"timestamp":"2026-09-04T14:05:28.276031+00:00","total_tokens":2437}
