{"agent_id":"agent_2","available_insight_ids":["INS-001","INS-002","INS-005","INS-006","INS-007","INS-008"],"block_index":183,"condition":"E","cumulative_input_tokens":2345,"cumulative_output_tokens":188,"cumulative_total_tokens":2533,"input_hash":"72f87789fbdc41f6b1e807367fd8cce5dcf1dcca10b46a5ec62cec0cb5b8a899","input_tokens":2345,"max_output_tokens":512,"max_structural_retries":2,"output_tokens":188,"parse_failure":false,"parsed_final_output":{"abstain":false,"predicted_label":"CLS-OJNSG","reasoning_summary":"Il profilo coincide con gli esempi CLS-OJNSG: anomalie persistenti di spostamento/pendenza, variabilità residua di XMEAS-10 in tutte le finestre e massima dispersione su XMEAS-1. Le sequenze di segno non mostrano un run coerente prolungato.","used_insight_ids":[]},"physical_case_id":"EXP3V2-F8-004","position_in_block":3,"previous_response_id_used":false,"prompt_character_count":7309,"prompt_hash":"f1aa8cb6326d1ac2e3fc7a5b364cf49f1fa6d1ed1d2fcfbc4dae4e640f7ff773","provider_attempts":[{"attempt":1,"intent_path":"request_journal/0551.attempt-1.intent.json","response":{"api_family":"Responses API","endpoint":"/v1/responses","input_tokens":2345,"output_tokens":188,"raw_output":"{\"predicted_label\":\"CLS-OJNSG\",\"abstain\":false,\"used_insight_ids\":[],\"reasoning_summary\":\"Il profilo coincide con gli esempi CLS-OJNSG: anomalie persistenti di spostamento/pendenza, variabilità residua di XMEAS-10 in tutte le finestre e massima dispersione su XMEAS-1. Le sequenze di segno non mostrano un run coerente prolungato.\"}","request_id":"req_bb1036cf7d9747f5a9b5b6ba98ade994","requested_model":"gpt-5.6-terra","response_id":"resp_0a2154a540dd5035016a9ad50cedbc87d2afec5df72663350b","response_raw":{"background":false,"billing":{"payer":"developer"},"completed_at":1788531983.0,"conversation":null,"created_at":1788531980.0,"error":null,"frequency_penalty":0.0,"id":"resp_0a2154a540dd5035016a9ad50cedbc87d2afec5df72663350b","incomplete_details":null,"instructions":null,"max_output_tokens":512,"max_tool_calls":null,"metadata":{},"model":"gpt-5.6-terra","moderation":null,"object":"response","output":[{"content":[],"encrypted_content":"gAAAAABqmtUQz097ZseIwmAvn1ZvWRDlQRbNJaAZqSEAvRJh_gAA9hnG6VE6rvtPzbSA6JRadlmN8K1DUsYz2GBhzIKIXOhKk-sabjfNj9PwFnJ4Zn8W9JjSQZ_E9_FIifFaN3VgqJQY91UphW1nE2-6gpW2mablilxJHVbUtxoCjlTKC-okHpnEjCo2NZLd44gnUZ4bL8IOYYOtCjgNbRwZJteloadFBfGNM7rj73wyaopFDc2KfZiu7Cm1-Mb0-54ItVkELPI0EyRx6q94KGLhGyaqPPYLclfW0Fsj6TGclqYoS5CfyE_OprngnA6JYQM4mv12e9amYptxDuSi_MSem2wLBiNV7EXrd_2k4y-W2hm_aK0sku3WMnrrbzRtz2nXCX8ss3I_O6dxcl0rjXm6Eb7jrcs26-aPXFQgPQqhQNMkBT8ea7i6j3USGwvv9GECgtaRjBWYBP1s4ykbve0et9Y3g5_DUIHqfA7NwOQ1NqaNX2niqWErf2UjYg80cYQRQDXgicd23-WFzr-9rWP_f-kt6UWmV_GQRyIxO8oNj-bDijkvuM0IoNktTxkYIcZpu0bdK7Go2yKjkHFBQ1-j2Puv549BgsfFNDSHiqOYa4fPxwqJ2FxT9t2CInEnSVZCguqQclmBuDmZxPOF-88HLgJArXLp1i9KzrudhGnonEb9X249D7dXYxHWWDr5sIH0AgFNBEv7vi9qkTEILcaqvaP3J_m1f_l4OqDPjn5YQ7I9UYmgOu6rhc6Qw-wd48GKx2kYtoCClXza463St0-r4R5y1L7ZFlkpvlmbQCvWipimP8at3LJGHksJ-bnQTEa-NX1beqJu0E2bUkz6dUUmFn3Sma8pvEfaWAvJxlEzJZFMeGfMyUWZuMDONhn3knfnGXgG6fZfeRonCqs-u2JElk9TGnxcdxzuH9nW8CnDAVQuhPSvN7cxqJuA4PBnP4PYsK9tb0zt0_XceZTpla5nFRLLWf8bUSw6xwo5yO0hea-5nYObP2ROKVN8njCtwbetT_xKO8RkPV_fAV5djbHvru7dUQvePD-0nZNnaDcai9PLViVBgL_qYB-zkncYhlnIj1uGXDcx3fgTR9MxIB8foq61qoQfRJ4Qy92nVVWqB8XId7e1yNyUx4dF5tJlHTiR3pNPdnoVVEvVBeGNB5Djb1eQUvH8ARGA-iqqzvdhLFaMDRS03PRUBdtqUTJMTEVe9YGgR459aC77ENcbsPUUENf2biCWrjXjzwll4ORWLMBCRMyE8jujOJjUg8NWRZzwvUtCcnRkVv-HNsAjhKLTZkBW4PwK9YIKkJQpDPkwVZFGzureQsZj6QBqNGP9-xTu-rKA2wMXfhoNmXcabS-oQJUbqxK6bm3UnXt2MYz4mUjhyByRcN-l2lmbTQ-vZ7G8hjC7Ih_P3WJWJqc0rB57QkJYrxMo7R0h61jRqUuaoqd4YUX03l3tK9K1oEdny9Tq1yxvY_4gGTIqeLOjfTW3yF218d_ECqsw2laQ3ldoXzxaN_YtriLmcJXoSmB955uYaXPkM5fxlJzgahmnEAxRmjvPldL89w==","id":"rs_0a2154a540dd5035016a9ad50d5e1487d28497bce03908f079","status":null,"summary":[],"type":"reasoning"},{"content":[{"annotations":[],"logprobs":[],"text":"{\"predicted_label\":\"CLS-OJNSG\",\"abstain\":false,\"used_insight_ids\":[],\"reasoning_summary\":\"Il profilo coincide con gli esempi CLS-OJNSG: anomalie persistenti di spostamento/pendenza, variabilità residua di XMEAS-10 in tutte le finestre e massima dispersione su XMEAS-1. Le sequenze di segno non mostrano un run coerente prolungato.\"}","type":"output_text"}],"id":"msg_0a2154a540dd5035016a9ad50e973c87d2b53c1423c0720242","phase":"final_answer","role":"assistant","status":"completed","type":"message"}],"parallel_tool_calls":true,"presence_penalty":0.0,"previous_response_id":null,"prompt":null,"prompt_cache_key":null,"prompt_cache_options":null,"prompt_cache_retention":"24h","reasoning":{"context":"all_turns","effort":"medium","generate_summary":null,"mode":"standard","summary":null},"safety_identifier":null,"service_tier":"default","status":"completed","store":false,"temperature":1.0,"text":{"format":{"description":null,"name":"phase_b_diagnostic_output","schema_":{"additionalProperties":false,"properties":{"abstain":{"type":"boolean"},"predicted_label":{"type":["string","null"]},"reasoning_summary":{"minLength":1,"type":"string"},"used_insight_ids":{"items":{"type":"string"},"type":"array"}},"required":["predicted_label","abstain","used_insight_ids","reasoning_summary"],"title":"Phase B diagnostic output (OpenAI Structured Outputs)","type":"object"},"strict":true,"type":"json_schema"},"verbosity":"medium"},"tool_choice":"auto","tool_usage":{"image_gen":{"input_tokens":0,"input_tokens_details":{"image_tokens":0,"text_tokens":0},"output_tokens":0,"output_tokens_details":{"image_tokens":0,"text_tokens":0},"total_tokens":0},"web_search":{"num_requests":0}},"tools":[],"top_logprobs":0,"top_p":0.98,"truncation":"disabled","usage":{"compute_units":null,"input_tokens":2345,"input_tokens_details":{"cache_write_tokens":2342,"cached_tokens":0},"output_tokens":188,"output_tokens_details":{"reasoning_tokens":77},"total_tokens":2533},"user":null},"returned_model":"gpt-5.6-terra","sdk_version":"3.6.0","total_tokens":2533,"usage_raw":{"compute_units":null,"input_tokens":2345,"input_tokens_details":{"cache_write_tokens":2342,"cached_tokens":0},"output_tokens":188,"output_tokens_details":{"reasoning_tokens":77},"total_tokens":2533}},"response_path":"request_journal/0551.attempt-1.response.json"}],"raw_attempts":["{\"predicted_label\":\"CLS-OJNSG\",\"abstain\":false,\"used_insight_ids\":[],\"reasoning_summary\":\"Il profilo coincide con gli esempi CLS-OJNSG: anomalie persistenti di spostamento/pendenza, variabilità residua di XMEAS-10 in tutte le finestre e massima dispersione su XMEAS-1. Le sequenze di segno non mostrano un run coerente prolungato.\"}"],"raw_output":"{\"predicted_label\":\"CLS-OJNSG\",\"abstain\":false,\"used_insight_ids\":[],\"reasoning_summary\":\"Il profilo coincide con gli esempi CLS-OJNSG: anomalie persistenti di spostamento/pendenza, variabilità residua di XMEAS-10 in tutte le finestre e massima dispersione su XMEAS-1. Le sequenze di segno non mostrano un run coerente prolungato.\"}","reasoning_effort":"medium","repetition":1,"requested_model":"gpt-5.6-terra","retry_count":0,"returned_model":"gpt-5.6-terra","seed":null,"sequence_index":551,"stateless":true,"store":false,"structural_validation_errors":[],"structured_outputs_strict":true,"temperature":null,"timestamp":"2026-09-04T14:26:24.100145+00:00","total_tokens":2533}
