{"agent_id":"agent_1","available_insight_ids":["INS-003","INS-004","INS-005","INS-006","INS-007","INS-008"],"block_index":38,"condition":"E","cumulative_input_tokens":2127,"cumulative_output_tokens":101,"cumulative_total_tokens":2228,"input_hash":"e0439c1a7eefc7b2fc85407e69fa874fbfc74b0d55d200957679da544161fdec","input_tokens":2127,"max_output_tokens":512,"max_structural_retries":2,"output_tokens":101,"parse_failure":false,"parsed_final_output":{"abstain":false,"predicted_label":"Normal","reasoning_summary":"Nessuno spostamento, pendenza o variabilità residua supera soglia; solo 2/8 variazioni campione-campione su XMEAS-41. Il quadro è coerente con gli esempi Normal, che tollerano rare anomalie locali di diff/residuo senza trend persistenti.","used_insight_ids":[]},"physical_case_id":"EXP3V2-N-004","position_in_block":1,"previous_response_id_used":false,"prompt_character_count":6704,"prompt_hash":"78d0e4c1e88e20c5ccdd6a271e659385f20b0838ecac8ad44781c126175020e8","provider_attempts":[{"attempt":1,"intent_path":"request_journal/0114.attempt-1.intent.json","response":{"api_family":"Responses API","endpoint":"/v1/responses","input_tokens":2127,"output_tokens":101,"raw_output":"{\"predicted_label\":\"Normal\",\"abstain\":false,\"used_insight_ids\":[],\"reasoning_summary\":\"Nessuno spostamento, pendenza o variabilità residua supera soglia; solo 2/8 variazioni campione-campione su XMEAS-41. Il quadro è coerente con gli esempi Normal, che tollerano rare anomalie locali di diff/residuo senza trend persistenti.\"}","request_id":"req_bf66612fdce844618a2ed8c94bc36789","requested_model":"gpt-5.6-terra","response_id":"resp_005c7c00ee191f1a016a9acf16813887d2992110e5770e9c8d","response_raw":{"background":false,"billing":{"payer":"developer"},"completed_at":1788530456.0,"conversation":null,"created_at":1788530454.0,"error":null,"frequency_penalty":0.0,"id":"resp_005c7c00ee191f1a016a9acf16813887d2992110e5770e9c8d","incomplete_details":null,"instructions":null,"max_output_tokens":512,"max_tool_calls":null,"metadata":{},"model":"gpt-5.6-terra","moderation":null,"object":"response","output":[{"content":[{"annotations":[],"logprobs":[],"text":"{\"predicted_label\":\"Normal\",\"abstain\":false,\"used_insight_ids\":[],\"reasoning_summary\":\"Nessuno spostamento, pendenza o variabilità residua supera soglia; solo 2/8 variazioni campione-campione su XMEAS-41. Il quadro è coerente con gli esempi Normal, che tollerano rare anomalie locali di diff/residuo senza trend persistenti.\"}","type":"output_text"}],"id":"msg_005c7c00ee191f1a016a9acf172c6c87d28b26a6efd52c55c6","phase":"final_answer","role":"assistant","status":"completed","type":"message"}],"parallel_tool_calls":true,"presence_penalty":0.0,"previous_response_id":null,"prompt":null,"prompt_cache_key":null,"prompt_cache_options":null,"prompt_cache_retention":"24h","reasoning":{"context":"all_turns","effort":"medium","generate_summary":null,"mode":"standard","summary":null},"safety_identifier":null,"service_tier":"default","status":"completed","store":false,"temperature":1.0,"text":{"format":{"description":null,"name":"phase_b_diagnostic_output","schema_":{"additionalProperties":false,"properties":{"abstain":{"type":"boolean"},"predicted_label":{"type":["string","null"]},"reasoning_summary":{"minLength":1,"type":"string"},"used_insight_ids":{"items":{"type":"string"},"type":"array"}},"required":["predicted_label","abstain","used_insight_ids","reasoning_summary"],"title":"Phase B diagnostic output (OpenAI Structured Outputs)","type":"object"},"strict":true,"type":"json_schema"},"verbosity":"medium"},"tool_choice":"auto","tool_usage":{"image_gen":{"input_tokens":0,"input_tokens_details":{"image_tokens":0,"text_tokens":0},"output_tokens":0,"output_tokens_details":{"image_tokens":0,"text_tokens":0},"total_tokens":0},"web_search":{"num_requests":0}},"tools":[],"top_logprobs":0,"top_p":0.98,"truncation":"disabled","usage":{"compute_units":null,"input_tokens":2127,"input_tokens_details":{"cache_write_tokens":0,"cached_tokens":2124},"output_tokens":101,"output_tokens_details":{"reasoning_tokens":0},"total_tokens":2228},"user":null},"returned_model":"gpt-5.6-terra","sdk_version":"3.6.0","total_tokens":2228,"usage_raw":{"compute_units":null,"input_tokens":2127,"input_tokens_details":{"cache_write_tokens":0,"cached_tokens":2124},"output_tokens":101,"output_tokens_details":{"reasoning_tokens":0},"total_tokens":2228}},"response_path":"request_journal/0114.attempt-1.response.json"}],"raw_attempts":["{\"predicted_label\":\"Normal\",\"abstain\":false,\"used_insight_ids\":[],\"reasoning_summary\":\"Nessuno spostamento, pendenza o variabilità residua supera soglia; solo 2/8 variazioni campione-campione su XMEAS-41. Il quadro è coerente con gli esempi Normal, che tollerano rare anomalie locali di diff/residuo senza trend persistenti.\"}"],"raw_output":"{\"predicted_label\":\"Normal\",\"abstain\":false,\"used_insight_ids\":[],\"reasoning_summary\":\"Nessuno spostamento, pendenza o variabilità residua supera soglia; solo 2/8 variazioni campione-campione su XMEAS-41. Il quadro è coerente con gli esempi Normal, che tollerano rare anomalie locali di diff/residuo senza trend persistenti.\"}","reasoning_effort":"medium","repetition":3,"requested_model":"gpt-5.6-terra","retry_count":0,"returned_model":"gpt-5.6-terra","seed":null,"sequence_index":114,"stateless":true,"store":false,"structural_validation_errors":[],"structured_outputs_strict":true,"temperature":null,"timestamp":"2026-09-04T14:00:57.073646+00:00","total_tokens":2228}
