{"agent_id":"agent_3","available_insight_ids":["INS-001","INS-002","INS-003","INS-004","INS-007","INS-008"],"block_index":115,"condition":"B","cumulative_input_tokens":2333,"cumulative_output_tokens":99,"cumulative_total_tokens":2432,"input_hash":"e501ac75992f84269d2a49fec0361a308257e280eace77a42ea20c12e8b2ead8","input_tokens":2333,"max_output_tokens":512,"max_structural_retries":2,"output_tokens":99,"parse_failure":false,"parsed_final_output":{"abstain":false,"predicted_label":"CLS-ZOGAA","reasoning_summary":"XMEAS-1 shows the characteristic persistent positive displacement across all 8 windows with an 8-window coherent run and maximum dispersion ratio 46.35. The early-only residual pattern on XMEAS-20 further matches the CLS-ZOGAA peer observations.","used_insight_ids":["INS-001","INS-002"]},"physical_case_id":"EXP3V2-F1-004","position_in_block":1,"previous_response_id_used":false,"prompt_character_count":7383,"prompt_hash":"1f7df700fdaaec703734b47b7b7ba733e7355501050b3453ab2eccf43e9e7b7b","provider_attempts":[{"attempt":1,"intent_path":"request_journal/0345.attempt-1.intent.json","response":{"api_family":"Responses API","endpoint":"/v1/responses","input_tokens":2333,"output_tokens":99,"raw_output":"{\"predicted_label\":\"CLS-ZOGAA\",\"abstain\":false,\"used_insight_ids\":[\"INS-001\",\"INS-002\"],\"reasoning_summary\":\"XMEAS-1 shows the characteristic persistent positive displacement across all 8 windows with an 8-window coherent run and maximum dispersion ratio 46.35. The early-only residual pattern on XMEAS-20 further matches the CLS-ZOGAA peer observations.\"}","request_id":"req_7101be7f522a4ede8c485f7dd8159116","requested_model":"gpt-5.6-terra","response_id":"resp_083b163a4e595cee016a9ad1b7889087d2acc90435c81a7d98","response_raw":{"background":false,"billing":{"payer":"developer"},"completed_at":1788531129.0,"conversation":null,"created_at":1788531127.0,"error":null,"frequency_penalty":0.0,"id":"resp_083b163a4e595cee016a9ad1b7889087d2acc90435c81a7d98","incomplete_details":null,"instructions":null,"max_output_tokens":512,"max_tool_calls":null,"metadata":{},"model":"gpt-5.6-terra","moderation":null,"object":"response","output":[{"content":[{"annotations":[],"logprobs":[],"text":"{\"predicted_label\":\"CLS-ZOGAA\",\"abstain\":false,\"used_insight_ids\":[\"INS-001\",\"INS-002\"],\"reasoning_summary\":\"XMEAS-1 shows the characteristic persistent positive displacement across all 8 windows with an 8-window coherent run and maximum dispersion ratio 46.35. The early-only residual pattern on XMEAS-20 further matches the CLS-ZOGAA peer observations.\"}","type":"output_text"}],"id":"msg_083b163a4e595cee016a9ad1b82a8887d2819db4be21c5ab26","phase":"final_answer","role":"assistant","status":"completed","type":"message"}],"parallel_tool_calls":true,"presence_penalty":0.0,"previous_response_id":null,"prompt":null,"prompt_cache_key":null,"prompt_cache_options":null,"prompt_cache_retention":"24h","reasoning":{"context":"all_turns","effort":"medium","generate_summary":null,"mode":"standard","summary":null},"safety_identifier":null,"service_tier":"default","status":"completed","store":false,"temperature":1.0,"text":{"format":{"description":null,"name":"phase_b_diagnostic_output","schema_":{"additionalProperties":false,"properties":{"abstain":{"type":"boolean"},"predicted_label":{"type":["string","null"]},"reasoning_summary":{"minLength":1,"type":"string"},"used_insight_ids":{"items":{"type":"string"},"type":"array"}},"required":["predicted_label","abstain","used_insight_ids","reasoning_summary"],"title":"Phase B diagnostic output (OpenAI Structured Outputs)","type":"object"},"strict":true,"type":"json_schema"},"verbosity":"medium"},"tool_choice":"auto","tool_usage":{"image_gen":{"input_tokens":0,"input_tokens_details":{"image_tokens":0,"text_tokens":0},"output_tokens":0,"output_tokens_details":{"image_tokens":0,"text_tokens":0},"total_tokens":0},"web_search":{"num_requests":0}},"tools":[],"top_logprobs":0,"top_p":0.98,"truncation":"disabled","usage":{"compute_units":null,"input_tokens":2333,"input_tokens_details":{"cache_write_tokens":0,"cached_tokens":2330},"output_tokens":99,"output_tokens_details":{"reasoning_tokens":0},"total_tokens":2432},"user":null},"returned_model":"gpt-5.6-terra","sdk_version":"3.6.0","total_tokens":2432,"usage_raw":{"compute_units":null,"input_tokens":2333,"input_tokens_details":{"cache_write_tokens":0,"cached_tokens":2330},"output_tokens":99,"output_tokens_details":{"reasoning_tokens":0},"total_tokens":2432}},"response_path":"request_journal/0345.attempt-1.response.json"}],"raw_attempts":["{\"predicted_label\":\"CLS-ZOGAA\",\"abstain\":false,\"used_insight_ids\":[\"INS-001\",\"INS-002\"],\"reasoning_summary\":\"XMEAS-1 shows the characteristic persistent positive displacement across all 8 windows with an 8-window coherent run and maximum dispersion ratio 46.35. The early-only residual pattern on XMEAS-20 further matches the CLS-ZOGAA peer observations.\"}"],"raw_output":"{\"predicted_label\":\"CLS-ZOGAA\",\"abstain\":false,\"used_insight_ids\":[\"INS-001\",\"INS-002\"],\"reasoning_summary\":\"XMEAS-1 shows the characteristic persistent positive displacement across all 8 windows with an 8-window coherent run and maximum dispersion ratio 46.35. The early-only residual pattern on XMEAS-20 further matches the CLS-ZOGAA peer observations.\"}","reasoning_effort":"medium","repetition":2,"requested_model":"gpt-5.6-terra","retry_count":0,"returned_model":"gpt-5.6-terra","seed":null,"sequence_index":345,"stateless":true,"store":false,"structural_validation_errors":[],"structured_outputs_strict":true,"temperature":null,"timestamp":"2026-09-04T14:12:09.586220+00:00","total_tokens":2432}
