{"agent_id":"agent_3","available_insight_ids":[],"block_index":151,"condition":"A","cumulative_input_tokens":1652,"cumulative_output_tokens":275,"cumulative_total_tokens":1927,"input_hash":"c9dec358709ede30706446b670d7b7302bccbab3e36177d7f3dcbdeda33e0e8e","input_tokens":1652,"max_output_tokens":512,"max_structural_retries":2,"output_tokens":275,"parse_failure":false,"parsed_final_output":{"abstain":true,"predicted_label":null,"reasoning_summary":"Il caso è chiaramente anomalo, con superamenti persistenti di spostamento, pendenza, variabilità e differenze. Tuttavia gli unici esempi anomali disponibili per CLS-R463B riguardano tutti XMEAS-18, mentre qui le anomalie principali coinvolgono variabili diverse; non è possibile associare in modo affidabile un'etichetta.","used_insight_ids":[]},"physical_case_id":"EXP3V2-F8-001","position_in_block":3,"previous_response_id_used":false,"prompt_character_count":4974,"prompt_hash":"475a75a688624280837f9333916dd287d305ae9d52981b68a1599c17acc72745","provider_attempts":[{"attempt":1,"intent_path":"request_journal/0455.attempt-1.intent.json","response":{"api_family":"Responses API","endpoint":"/v1/responses","input_tokens":1652,"output_tokens":275,"raw_output":"{\"predicted_label\":null,\"abstain\":true,\"used_insight_ids\":[],\"reasoning_summary\":\"Il caso è chiaramente anomalo, con superamenti persistenti di spostamento, pendenza, variabilità e differenze. Tuttavia gli unici esempi anomali disponibili per CLS-R463B riguardano tutti XMEAS-18, mentre qui le anomalie principali coinvolgono variabili diverse; non è possibile associare in modo affidabile un'etichetta.\"}","request_id":"req_4298266c17b24f1da4523c9e02ba1af6","requested_model":"gpt-5.6-terra","response_id":"resp_05fd7f0f66d86261016a9ad3422f6c87d28fd73e5783a74327","response_raw":{"background":false,"billing":{"payer":"developer"},"completed_at":1788531526.0,"conversation":null,"created_at":1788531522.0,"error":null,"frequency_penalty":0.0,"id":"resp_05fd7f0f66d86261016a9ad3422f6c87d28fd73e5783a74327","incomplete_details":null,"instructions":null,"max_output_tokens":512,"max_tool_calls":null,"metadata":{},"model":"gpt-5.6-terra","moderation":null,"object":"response","output":[{"content":[],"encrypted_content":"gAAAAABqmtNHi88W0MGEuvwTlTPJ6EyN9BCuwI_E68Ynui_XDVjQnvnKt1dQDsqhT-DGI3IYUgQ_j19uCKHiPcp8RaBOb7QuHCPGkrzN70ihFYyBof42TUkA-pmlww2sPNBX0GhnqCLLTi8bXQqmvUteL7rLbm1OC09HEYHdLLGWzgp-KpYPYZCrCgv65lfowjwUi5ZcVp_2s7kkgwW7YIjb_BNWMf4B_HItvdHUVP75rbt8rMheDzM7Ki2SWm_GbEH_BzYEhg27YYIBLr7Ig203TnwvkwISUl6c9IhG6gWuhoNwALCgJwxPSVGtxzJP_lqY7DKV20FAJR5AU8Z08UpgClGVnxv3fVCADO_XgyI17EH9WjmEry15-0Rf3Q_BV4ZN19oewR4B5ikpNIEZfTKMUWupsKMNiQLoScAH9dfjKN3DxFUKP1pLEMzElkMkRYV06kYqSktGvTlFhiaO3X1WlhRm5_BjsqyDkXAYIWXWC1GIgudNK8CXId0IrJ-K4vVLqySZzf8J2tG2wqn8c1-m6m9AFhXAHAkv_J8DZ1OgxyXoSbho7oVll5V-5kIIByzG1A4jmzRDbfDKrbAHnUCDmx1HRjnDyUYdGS_F7Bsw95MJaGBmaZA0et5gxtTxNDUgXSH2DqOxcZqxcOth-IDgyb7HIUQxcnC_zoB5D5q4XPPcyez4cHM870eOv4YIygGZb3-4mb4ZhMlOlj6uRScrZkjIdt1zOZA5CEMZF4_8B1baV-Em_sOx7-xPW2QBDA2MILo3wvVwSYkPnGgVFNHvNLjY4yp2QLj7gPLwk5T9uAI3Ak6L77fhMTqqOhJMvYCbSVeqoiokNfvuELGuKK6EH8XWjwY1wzG3g0NbQOCxkI9XD7pI5yn8VooSjTmy9qk1rBMGaBHhExqGSB-S9NGOARcompzOoyB1tFf6obTJkUrXSQBC_KYarK1NsNEdNVbP3Iy72nN1bQ5FyOlBALuO3gUls4xmmVEZLPZ6KZ1ljU5T7PbiJAzBjwZmRs5KdTdrAVY-OldJZ3Oe4-2zdoHozhgI5MTNPxTNd5ucV0KozxAk6jtNyCeK9FbYDjXc237elm1Gylq5pPBX3FHoxWIp5fKQiFQXiM5MpDrZ37s6hZ1CqC-DaTjv2LPF2u7wE-gLPxCwpG0MezowETAv5yM5TSPwhyZMnGcE1XUKGl7GUmbYBx5_obeeT1AezUgNGzPi55oimwp5aCDXe0puu3FwXGgP-dn9sfONihc894ULUxYvBJAFuzbbbjI8DAa8Fy2Cva-OPMQNjwW1fHxZFdfN2grxNGparXUYMF8S1uGVqihs9OkR_rH67Zs-QIqJx44_Hb2--CEoln7V0h3_ICrotHbK94QppeWz9HYmYIDa6OBOTFMmFyrDiQ4c-VL6Bu_V4oNomuFW-pyOSVvRKyZ4EW1MZd7Wts6UX83kZHbsO7fa3HOjsuRHEp-zVxS2ALnzhAbha1XTqjYk9JxZHsLAeNvhZZ2A2p8hTnKpsnOrS5uWYOYcZ1fKS07E3fKCbD51xTRUz2AHI7dZYI-DQimSK1gnvEdO27pSZb4jyMr6wFBZeY1lzzGkoTzTEymeMQmgxy1-NJfuZ1cr6A-CrMCNaKEF7XKREbibhM8bVXl-G4U4KQkjCQ5eEsJmUUevb9cHy8dPRtaE_3A-V5rjdDgrD1zks999R25lDuCAFNxJLUe1K3BxndoFvW6WdIkj_p1J9kktjlRJBmRwtLtrfAqqtID3S3brxg8gnC3qg8xkDCs9Zo2ij2qfZ957kJQ3MLOb0sQzx8UVWFpRJIlRqYYb4fizYxLMjBorMPH5M2PgQHZ_Y0-5xyixyyO7FveZLxxW0FJdN1YIAl0LrE4b8H1JVVdxBOCyULjcGJ38jwK4b8fZ0NDWjTM9Nhn-pGHbSHNsoUpjvTpzV5b8HVnRAW8598hS8y0BZ01BI2hXkY7ylNPmidbHDby5oBiJ1aukSTyD7U9zF0KAFCRcnRGm6alGGQIfbJZgnu8F-rmkFQ_2PXfAlrEwxj2cMauGKueHf-9O0j7XL4VIq60J3lO_QL66nhAuU3ldQ7tc893gka2EYPz_jCvG-T1LKoGq0bOlxk01E5u86PpUre4q35srRhV9aL0TrzlOlErLF0z-dEI7wIlMC6wieGmNoegpoKUM7kMxVOH_gJ30kHhc9AY9TevJdrueiiDOIw==","id":"rs_05fd7f0f66d86261016a9ad342b40087d2b4ca9cd9c403d957","status":null,"summary":[],"type":"reasoning"},{"content":[{"annotations":[],"logprobs":[],"text":"{\"predicted_label\":null,\"abstain\":true,\"used_insight_ids\":[],\"reasoning_summary\":\"Il caso è chiaramente anomalo, con superamenti persistenti di spostamento, pendenza, variabilità e differenze. Tuttavia gli unici esempi anomali disponibili per CLS-R463B riguardano tutti XMEAS-18, mentre qui le anomalie principali coinvolgono variabili diverse; non è possibile associare in modo affidabile un'etichetta.\"}","type":"output_text"}],"id":"msg_05fd7f0f66d86261016a9ad34573ac87d2a12ccf0adcc63b33","phase":"final_answer","role":"assistant","status":"completed","type":"message"}],"parallel_tool_calls":true,"presence_penalty":0.0,"previous_response_id":null,"prompt":null,"prompt_cache_key":null,"prompt_cache_options":null,"prompt_cache_retention":"24h","reasoning":{"context":"all_turns","effort":"medium","generate_summary":null,"mode":"standard","summary":null},"safety_identifier":null,"service_tier":"default","status":"completed","store":false,"temperature":1.0,"text":{"format":{"description":null,"name":"phase_b_diagnostic_output","schema_":{"additionalProperties":false,"properties":{"abstain":{"type":"boolean"},"predicted_label":{"type":["string","null"]},"reasoning_summary":{"minLength":1,"type":"string"},"used_insight_ids":{"items":{"type":"string"},"type":"array"}},"required":["predicted_label","abstain","used_insight_ids","reasoning_summary"],"title":"Phase B diagnostic output (OpenAI Structured Outputs)","type":"object"},"strict":true,"type":"json_schema"},"verbosity":"medium"},"tool_choice":"auto","tool_usage":{"image_gen":{"input_tokens":0,"input_tokens_details":{"image_tokens":0,"text_tokens":0},"output_tokens":0,"output_tokens_details":{"image_tokens":0,"text_tokens":0},"total_tokens":0},"web_search":{"num_requests":0}},"tools":[],"top_logprobs":0,"top_p":0.98,"truncation":"disabled","usage":{"compute_units":null,"input_tokens":1652,"input_tokens_details":{"cache_write_tokens":0,"cached_tokens":1649},"output_tokens":275,"output_tokens_details":{"reasoning_tokens":157},"total_tokens":1927},"user":null},"returned_model":"gpt-5.6-terra","sdk_version":"3.6.0","total_tokens":1927,"usage_raw":{"compute_units":null,"input_tokens":1652,"input_tokens_details":{"cache_write_tokens":0,"cached_tokens":1649},"output_tokens":275,"output_tokens_details":{"reasoning_tokens":157},"total_tokens":1927}},"response_path":"request_journal/0455.attempt-1.response.json"}],"raw_attempts":["{\"predicted_label\":null,\"abstain\":true,\"used_insight_ids\":[],\"reasoning_summary\":\"Il caso è chiaramente anomalo, con superamenti persistenti di spostamento, pendenza, variabilità e differenze. Tuttavia gli unici esempi anomali disponibili per CLS-R463B riguardano tutti XMEAS-18, mentre qui le anomalie principali coinvolgono variabili diverse; non è possibile associare in modo affidabile un'etichetta.\"}"],"raw_output":"{\"predicted_label\":null,\"abstain\":true,\"used_insight_ids\":[],\"reasoning_summary\":\"Il caso è chiaramente anomalo, con superamenti persistenti di spostamento, pendenza, variabilità e differenze. Tuttavia gli unici esempi anomali disponibili per CLS-R463B riguardano tutti XMEAS-18, mentre qui le anomalie principali coinvolgono variabili diverse; non è possibile associare in modo affidabile un'etichetta.\"}","reasoning_effort":"medium","repetition":2,"requested_model":"gpt-5.6-terra","retry_count":0,"returned_model":"gpt-5.6-terra","seed":null,"sequence_index":455,"stateless":true,"store":false,"structural_validation_errors":[],"structured_outputs_strict":true,"temperature":null,"timestamp":"2026-09-04T14:18:47.087294+00:00","total_tokens":1927}
