{"agent_id":"agent_4","available_insight_ids":["INS-001","INS-002","INS-003","INS-004","INS-005","INS-006"],"block_index":333,"condition":"E","cumulative_input_tokens":2337,"cumulative_output_tokens":322,"cumulative_total_tokens":2659,"input_hash":"7ce8b32c40175d1edd754f45e8ddd43118cdf3d85565f7255867eb9939fc4794","input_tokens":2337,"max_output_tokens":512,"max_structural_retries":2,"output_tokens":322,"parse_failure":false,"parsed_final_output":{"abstain":false,"predicted_label":"CLS-Z3ISU","reasoning_summary":"Il profilo coincide con gli esempi CLS-Z3ISU: superamenti persistenti di spostamento e pendenza, variabilità residua in tutte le finestre e numerose anomalie diff/joint. La massima dispersione su XMEAS-7 rafforza questa corrispondenza.","used_insight_ids":[]},"physical_case_id":"EXP3V2-F13-004","position_in_block":3,"previous_response_id_used":false,"prompt_character_count":7315,"prompt_hash":"73afe196c8575b2d1023cb749e15f78b9cb442beea4b55fd1724c71d01c21bd6","provider_attempts":[{"attempt":1,"intent_path":"request_journal/1001.attempt-1.intent.json","response":{"api_family":"Responses API","endpoint":"/v1/responses","input_tokens":2337,"output_tokens":322,"raw_output":"{\"predicted_label\":\"CLS-Z3ISU\",\"abstain\":false,\"used_insight_ids\":[],\"reasoning_summary\":\"Il profilo coincide con gli esempi CLS-Z3ISU: superamenti persistenti di spostamento e pendenza, variabilità residua in tutte le finestre e numerose anomalie diff/joint. La massima dispersione su XMEAS-7 rafforza questa corrispondenza.\"}","request_id":"req_881c681a6d7044249dd3b3f51867da61","requested_model":"gpt-5.6-terra","response_id":"resp_057b9efbd11fe885016a9adbcc9f4087d29cd58b99c2ad8cc5","response_raw":{"background":false,"billing":{"payer":"developer"},"completed_at":1788533713.0,"conversation":null,"created_at":1788533708.0,"error":null,"frequency_penalty":0.0,"id":"resp_057b9efbd11fe885016a9adbcc9f4087d29cd58b99c2ad8cc5","incomplete_details":null,"instructions":null,"max_output_tokens":512,"max_tool_calls":null,"metadata":{},"model":"gpt-5.6-terra","moderation":null,"object":"response","output":[{"content":[],"encrypted_content":"gAAAAABqmtvRw7bZw2EO9SssdV1hStfm0mfeprT8a2R6zGswpewtTi1n28v0ACBa5ltOF0Q8jwPiedGX0Ik2I23xcpnPacH3xMIaHXWju6RHjWjxa1BU76N1oyrwuJYQmONXSd9eVVPIOQkYM5fJx76PC8doafyQjhAOP8o4OjYtR9UXKQKFsQmpm5FUhvpZuomINvcimpkagE42IikYmlGIF9X9rjxEK2hUCDYJAZRzRl3fyrH81eUPnLKa3yiY9KFIsJKS_FC1A7oekHHHMxgG3TWW85iZ_I1C5dW7IIPqn-aVvJBe2rUDKzgyuKQ8zQjhW_fSMyfns23DGoeC0bo6XTXPn9_C88pDKolMVVMKlK7XCy5cD7PXM1jxK-2MvPdmMa-R4QPgzLxz9KRqF6Lo0-EGvednNepUYjxmev-Amot8DubfgGwIilL4Jvu0iRZZrelMyy_9YSiT092BKO4_OoWF0Dt1zh6N5fyX4MuL2a_pNSdBUAdkDX-k7ECjVmNto7F9oPrV2bG5XDgJ4upYTELD30pq2HNVQaNryqcRtqYg5FzbKQSVTqzIvEd7BvSXHIKzhrv7dXaM1ytBrGkjWXQ780sg3Atwgdi-CKaSQblgjo4Ut_cIIMUkOsG-ibTJxGKaVNzb08iRdQqPISBTFwD2rm85f_rzWEJj4YtsDf-SCcAO1pJw5jsgeCzglBv0I9VZJDm1NX9LvlxZJUOQ1-H5Ntxlb9VNQ0XPQrls9Lt0q4bwjey6L_ZsxMF6jO6EWqxYLIx-GBrcOhYB8Ox-oaNoW-MmDlQeEm1T5iV0hS1BnurUCXLzRNJDlG3In7K6mf9HXo11UgB6ylIy1tAD_kIIutccPGhtn2dLl9DHJSI3ZG1tQQPcENswsvCb6Dy-GCKzdhVCV-cXa9Z8_iNoC-42HrOUuIwMfRb5XOnO6t2XQ1f06YYFTp_tblAO0xJeqb3pX2NAV_xD3-HPdoIdvf6G-u7Gk2Ya09jSP2q8lSiYlIzQ3kKenV47UL-NnwEZbeBiPqDRRAgRWXWqnZoNfSZpLW5sZujfKj4ng3Cr3Fkagj0uCf9Q9K86Pry2IQgivTRmsy5mScpFimW2YuXveC-kZGqGJBRgNPHU7Ul8WDNn--VYGZhcbKjO8Kz1f6OrfA5vUVhe_sf4qsk3EN8CNMfacqLIwtzb3ut9uOCRFjQ4vpPDjHs6pNLzoiD4mcqi06KUreeG5otrjWOTuYnrwt-PKzkr2IEIJwL8O_6GFLaTaQTYpBQ-IsbE8yXqdZzmWLIOL8sIk2_fPfAZuXZ2-ZGsY4tKwwpyZY7xZvZw-apwna-cJlvu3NkbCYRgicyQzbm113KV1WidELWib3oIgx_iBtw1gPRai26Je85hbKJd_2_jrCpE3gdyMi6RjMdxOEYcTO27qCpeTwnRGi3c1CeZVEf2Mtaz1VuFsG_XYv7zFmM-siS3sL061M1A2IOqqi05rSLpNlgVMo9GNPwH-2JOG5MgeVnNhf7IB2w9jtWx5qYsKlsjaRpl87gr2bVXZzjIfrPWlvdMho_s3yv-KhZmnBo37hxlPpreSawWMrAv7Git_8_BjybPa2DElMuzXGRzi0dXFTe1qeDIuKr3bm5ogy9Cp8rH2GlhJcQlLc5khSHMDUJWqOx944mmGFLPKHI2C9EklWpwUqubT5ZfFE22jkuAJE0Ds_9ZQRnrElU303pM9_6XMZHWuYR_kiAOG3OXCTYfdBQInRGrZgbGBMssrLjUwAWQHPzf2S5waTX_njqD9cgzgWVyik0AB4DnE6l9w-S7s54T5OJQn0wC_60CGvEtx0_-5Qlt2QS9LgDwjCIMWbvdRzfqYWNcVbU3EhXmrozK9jFkETAkgesbctMN28SqHIP92BoS9F84_RYfZqtX_fMQC_JHjB7pplKphSK0NuQHzGfqGkk4jGxP1EjoBR0aji8thJgemt9KzrjKg2Um9QG7E7Cbgwb8mJFjnuMZDmo6HMGoLsIDkK9vu5mLVzgAlo4RAAVDMdC6_dZUltRmPG06ImV8tfvBli2QgpVgfNXNSXBV1nksTdqNKar7NEJeb6czcVwN_OKwE0akrEzt5M8PG-oef35ZhzR0gST8nkdP4kCLJM3qcVvK1-xxclFcifj3NJMPoVmv54hdQkP4k5CW_i4zZICQsMhVYiCw9C9OuFLxOohJoBAB-o9LXmUY07Gu43HICJH8vpayMGS_Ey9Yr5_1rnmETmgoC9-CoS2hBRFg7qTa-0P9ZraC8PGxFA==","id":"rs_057b9efbd11fe885016a9adbcd233487d280b4af7dd98d5435","status":null,"summary":[],"type":"reasoning"},{"content":[{"annotations":[],"logprobs":[],"text":"{\"predicted_label\":\"CLS-Z3ISU\",\"abstain\":false,\"used_insight_ids\":[],\"reasoning_summary\":\"Il profilo coincide con gli esempi CLS-Z3ISU: superamenti persistenti di spostamento e pendenza, variabilità residua in tutte le finestre e numerose anomalie diff/joint. La massima dispersione su XMEAS-7 rafforza questa corrispondenza.\"}","type":"output_text"}],"id":"msg_057b9efbd11fe885016a9adbd0213c87d29322c8b446cdaead","phase":"final_answer","role":"assistant","status":"completed","type":"message"}],"parallel_tool_calls":true,"presence_penalty":0.0,"previous_response_id":null,"prompt":null,"prompt_cache_key":null,"prompt_cache_options":null,"prompt_cache_retention":"24h","reasoning":{"context":"all_turns","effort":"medium","generate_summary":null,"mode":"standard","summary":null},"safety_identifier":null,"service_tier":"default","status":"completed","store":false,"temperature":1.0,"text":{"format":{"description":null,"name":"phase_b_diagnostic_output","schema_":{"additionalProperties":false,"properties":{"abstain":{"type":"boolean"},"predicted_label":{"type":["string","null"]},"reasoning_summary":{"minLength":1,"type":"string"},"used_insight_ids":{"items":{"type":"string"},"type":"array"}},"required":["predicted_label","abstain","used_insight_ids","reasoning_summary"],"title":"Phase B diagnostic output (OpenAI Structured Outputs)","type":"object"},"strict":true,"type":"json_schema"},"verbosity":"medium"},"tool_choice":"auto","tool_usage":{"image_gen":{"input_tokens":0,"input_tokens_details":{"image_tokens":0,"text_tokens":0},"output_tokens":0,"output_tokens_details":{"image_tokens":0,"text_tokens":0},"total_tokens":0},"web_search":{"num_requests":0}},"tools":[],"top_logprobs":0,"top_p":0.98,"truncation":"disabled","usage":{"compute_units":null,"input_tokens":2337,"input_tokens_details":{"cache_write_tokens":2334,"cached_tokens":0},"output_tokens":322,"output_tokens_details":{"reasoning_tokens":216},"total_tokens":2659},"user":null},"returned_model":"gpt-5.6-terra","sdk_version":"3.6.0","total_tokens":2659,"usage_raw":{"compute_units":null,"input_tokens":2337,"input_tokens_details":{"cache_write_tokens":2334,"cached_tokens":0},"output_tokens":322,"output_tokens_details":{"reasoning_tokens":216},"total_tokens":2659}},"response_path":"request_journal/1001.attempt-1.response.json"}],"raw_attempts":["{\"predicted_label\":\"CLS-Z3ISU\",\"abstain\":false,\"used_insight_ids\":[],\"reasoning_summary\":\"Il profilo coincide con gli esempi CLS-Z3ISU: superamenti persistenti di spostamento e pendenza, variabilità residua in tutte le finestre e numerose anomalie diff/joint. La massima dispersione su XMEAS-7 rafforza questa corrispondenza.\"}"],"raw_output":"{\"predicted_label\":\"CLS-Z3ISU\",\"abstain\":false,\"used_insight_ids\":[],\"reasoning_summary\":\"Il profilo coincide con gli esempi CLS-Z3ISU: superamenti persistenti di spostamento e pendenza, variabilità residua in tutte le finestre e numerose anomalie diff/joint. La massima dispersione su XMEAS-7 rafforza questa corrispondenza.\"}","reasoning_effort":"medium","repetition":1,"requested_model":"gpt-5.6-terra","retry_count":0,"returned_model":"gpt-5.6-terra","seed":null,"sequence_index":1001,"stateless":true,"store":false,"structural_validation_errors":[],"structured_outputs_strict":true,"temperature":null,"timestamp":"2026-09-04T14:55:13.626227+00:00","total_tokens":2659}
