{"agent_id":"agent_3","available_insight_ids":["INS-001","INS-002","INS-003","INS-004","INS-007","INS-008"],"block_index":354,"condition":"B","cumulative_input_tokens":2333,"cumulative_output_tokens":130,"cumulative_total_tokens":2463,"input_hash":"eed50391fce02c6ed8b08b6ec32e62ca953aef47d648e2143ffd32301ebecff6","input_tokens":2333,"max_output_tokens":512,"max_structural_retries":2,"output_tokens":130,"parse_failure":false,"parsed_final_output":{"abstain":false,"predicted_label":"CLS-Z3ISU","reasoning_summary":"Il caso coincide con il profilo CLS-Z3ISU: spostamento e pendenza sopra soglia in 8/8 finestre, variabilità residua di XMEAS-7 in tutte le finestre e massima dispersione su XMEAS-7. La persistenza dall'inizio alla fine e il rapporto di dispersione elevato rafforzano questa corrispondenza.","used_insight_ids":["INS-007","INS-008"]},"physical_case_id":"EXP3V2-F13-006","position_in_block":2,"previous_response_id_used":false,"prompt_character_count":7383,"prompt_hash":"1aabb7b534a10220f8e88d8abbe0aedacd4da90b4c0179f00891277875139dc7","provider_attempts":[{"attempt":1,"intent_path":"request_journal/1063.attempt-1.intent.json","response":{"api_family":"Responses API","endpoint":"/v1/responses","input_tokens":2333,"output_tokens":130,"raw_output":"{\"predicted_label\":\"CLS-Z3ISU\",\"abstain\":false,\"used_insight_ids\":[\"INS-007\",\"INS-008\"],\"reasoning_summary\":\"Il caso coincide con il profilo CLS-Z3ISU: spostamento e pendenza sopra soglia in 8/8 finestre, variabilità residua di XMEAS-7 in tutte le finestre e massima dispersione su XMEAS-7. La persistenza dall'inizio alla fine e il rapporto di dispersione elevato rafforzano questa corrispondenza.\"}","request_id":"req_8e65be434bf24d79aa76c7d8a1d61bc1","requested_model":"gpt-5.6-terra","response_id":"resp_010649f610440fc1016a9adcc4d8ac87d2923c1950e48dc683","response_raw":{"background":false,"billing":{"payer":"developer"},"completed_at":1788533959.0,"conversation":null,"created_at":1788533956.0,"error":null,"frequency_penalty":0.0,"id":"resp_010649f610440fc1016a9adcc4d8ac87d2923c1950e48dc683","incomplete_details":null,"instructions":null,"max_output_tokens":512,"max_tool_calls":null,"metadata":{},"model":"gpt-5.6-terra","moderation":null,"object":"response","output":[{"content":[{"annotations":[],"logprobs":[],"text":"{\"predicted_label\":\"CLS-Z3ISU\",\"abstain\":false,\"used_insight_ids\":[\"INS-007\",\"INS-008\"],\"reasoning_summary\":\"Il caso coincide con il profilo CLS-Z3ISU: spostamento e pendenza sopra soglia in 8/8 finestre, variabilità residua di XMEAS-7 in tutte le finestre e massima dispersione su XMEAS-7. La persistenza dall'inizio alla fine e il rapporto di dispersione elevato rafforzano questa corrispondenza.\"}","type":"output_text"}],"id":"msg_010649f610440fc1016a9adcc5efa887d289b58c679f58c84b","phase":"final_answer","role":"assistant","status":"completed","type":"message"}],"parallel_tool_calls":true,"presence_penalty":0.0,"previous_response_id":null,"prompt":null,"prompt_cache_key":null,"prompt_cache_options":null,"prompt_cache_retention":"24h","reasoning":{"context":"all_turns","effort":"medium","generate_summary":null,"mode":"standard","summary":null},"safety_identifier":null,"service_tier":"default","status":"completed","store":false,"temperature":1.0,"text":{"format":{"description":null,"name":"phase_b_diagnostic_output","schema_":{"additionalProperties":false,"properties":{"abstain":{"type":"boolean"},"predicted_label":{"type":["string","null"]},"reasoning_summary":{"minLength":1,"type":"string"},"used_insight_ids":{"items":{"type":"string"},"type":"array"}},"required":["predicted_label","abstain","used_insight_ids","reasoning_summary"],"title":"Phase B diagnostic output (OpenAI Structured Outputs)","type":"object"},"strict":true,"type":"json_schema"},"verbosity":"medium"},"tool_choice":"auto","tool_usage":{"image_gen":{"input_tokens":0,"input_tokens_details":{"image_tokens":0,"text_tokens":0},"output_tokens":0,"output_tokens_details":{"image_tokens":0,"text_tokens":0},"total_tokens":0},"web_search":{"num_requests":0}},"tools":[],"top_logprobs":0,"top_p":0.98,"truncation":"disabled","usage":{"compute_units":null,"input_tokens":2333,"input_tokens_details":{"cache_write_tokens":2330,"cached_tokens":0},"output_tokens":130,"output_tokens_details":{"reasoning_tokens":0},"total_tokens":2463},"user":null},"returned_model":"gpt-5.6-terra","sdk_version":"3.6.0","total_tokens":2463,"usage_raw":{"compute_units":null,"input_tokens":2333,"input_tokens_details":{"cache_write_tokens":2330,"cached_tokens":0},"output_tokens":130,"output_tokens_details":{"reasoning_tokens":0},"total_tokens":2463}},"response_path":"request_journal/1063.attempt-1.response.json"}],"raw_attempts":["{\"predicted_label\":\"CLS-Z3ISU\",\"abstain\":false,\"used_insight_ids\":[\"INS-007\",\"INS-008\"],\"reasoning_summary\":\"Il caso coincide con il profilo CLS-Z3ISU: spostamento e pendenza sopra soglia in 8/8 finestre, variabilità residua di XMEAS-7 in tutte le finestre e massima dispersione su XMEAS-7. La persistenza dall'inizio alla fine e il rapporto di dispersione elevato rafforzano questa corrispondenza.\"}"],"raw_output":"{\"predicted_label\":\"CLS-Z3ISU\",\"abstain\":false,\"used_insight_ids\":[\"INS-007\",\"INS-008\"],\"reasoning_summary\":\"Il caso coincide con il profilo CLS-Z3ISU: spostamento e pendenza sopra soglia in 8/8 finestre, variabilità residua di XMEAS-7 in tutte le finestre e massima dispersione su XMEAS-7. La persistenza dall'inizio alla fine e il rapporto di dispersione elevato rafforzano questa corrispondenza.\"}","reasoning_effort":"medium","repetition":1,"requested_model":"gpt-5.6-terra","retry_count":0,"returned_model":"gpt-5.6-terra","seed":null,"sequence_index":1063,"stateless":true,"store":false,"structural_validation_errors":[],"structured_outputs_strict":true,"temperature":null,"timestamp":"2026-09-04T14:59:19.897089+00:00","total_tokens":2463}
