{"agent_id":"agent_1","available_insight_ids":[],"block_index":132,"condition":"A","cumulative_input_tokens":1638,"cumulative_output_tokens":109,"cumulative_total_tokens":1747,"input_hash":"c9c4823fc7ed03bcdc18a8990b136419e90ef0054c6f1d1ec5345d1d56f3d7cc","input_tokens":1638,"max_output_tokens":512,"max_structural_retries":2,"output_tokens":109,"parse_failure":false,"parsed_final_output":{"abstain":false,"predicted_label":"CLS-ZOGAA","reasoning_summary":"Il caso coincide con gli esempi CLS-ZOGAA nel persistente spostamento positivo di XMEAS-1 in 8/8 finestre, nelle pendenze intermittenti e nell'elevata dispersione su XMEAS-1. Le differenze minori nelle conte di residual/diff non alterano il profilo dominante.","used_insight_ids":[]},"physical_case_id":"EXP3V2-F1-006","position_in_block":1,"previous_response_id_used":false,"prompt_character_count":4939,"prompt_hash":"ebdf8bff2b055ff61aa65881b4ba03f0d9553ea1f7608bd2913328510f31b548","provider_attempts":[{"attempt":1,"intent_path":"request_journal/0396.attempt-1.intent.json","response":{"api_family":"Responses API","endpoint":"/v1/responses","input_tokens":1638,"output_tokens":109,"raw_output":"{\"predicted_label\":\"CLS-ZOGAA\",\"abstain\":false,\"used_insight_ids\":[],\"reasoning_summary\":\"Il caso coincide con gli esempi CLS-ZOGAA nel persistente spostamento positivo di XMEAS-1 in 8/8 finestre, nelle pendenze intermittenti e nell'elevata dispersione su XMEAS-1. Le differenze minori nelle conte di residual/diff non alterano il profilo dominante.\"}","request_id":"req_348792818ba44cfd9fb80aff62b40519","requested_model":"gpt-5.6-terra","response_id":"resp_084decfdce8e92e3016a9ad25e1bc487d2855cea264921ecbe","response_raw":{"background":false,"billing":{"payer":"developer"},"completed_at":1788531296.0,"conversation":null,"created_at":1788531294.0,"error":null,"frequency_penalty":0.0,"id":"resp_084decfdce8e92e3016a9ad25e1bc487d2855cea264921ecbe","incomplete_details":null,"instructions":null,"max_output_tokens":512,"max_tool_calls":null,"metadata":{},"model":"gpt-5.6-terra","moderation":null,"object":"response","output":[{"content":[{"annotations":[],"logprobs":[],"text":"{\"predicted_label\":\"CLS-ZOGAA\",\"abstain\":false,\"used_insight_ids\":[],\"reasoning_summary\":\"Il caso coincide con gli esempi CLS-ZOGAA nel persistente spostamento positivo di XMEAS-1 in 8/8 finestre, nelle pendenze intermittenti e nell'elevata dispersione su XMEAS-1. Le differenze minori nelle conte di residual/diff non alterano il profilo dominante.\"}","type":"output_text"}],"id":"msg_084decfdce8e92e3016a9ad25ea68c87d290a46bc49fada9bd","phase":"final_answer","role":"assistant","status":"completed","type":"message"}],"parallel_tool_calls":true,"presence_penalty":0.0,"previous_response_id":null,"prompt":null,"prompt_cache_key":null,"prompt_cache_options":null,"prompt_cache_retention":"24h","reasoning":{"context":"all_turns","effort":"medium","generate_summary":null,"mode":"standard","summary":null},"safety_identifier":null,"service_tier":"default","status":"completed","store":false,"temperature":1.0,"text":{"format":{"description":null,"name":"phase_b_diagnostic_output","schema_":{"additionalProperties":false,"properties":{"abstain":{"type":"boolean"},"predicted_label":{"type":["string","null"]},"reasoning_summary":{"minLength":1,"type":"string"},"used_insight_ids":{"items":{"type":"string"},"type":"array"}},"required":["predicted_label","abstain","used_insight_ids","reasoning_summary"],"title":"Phase B diagnostic output (OpenAI Structured Outputs)","type":"object"},"strict":true,"type":"json_schema"},"verbosity":"medium"},"tool_choice":"auto","tool_usage":{"image_gen":{"input_tokens":0,"input_tokens_details":{"image_tokens":0,"text_tokens":0},"output_tokens":0,"output_tokens_details":{"image_tokens":0,"text_tokens":0},"total_tokens":0},"web_search":{"num_requests":0}},"tools":[],"top_logprobs":0,"top_p":0.98,"truncation":"disabled","usage":{"compute_units":null,"input_tokens":1638,"input_tokens_details":{"cache_write_tokens":1635,"cached_tokens":0},"output_tokens":109,"output_tokens_details":{"reasoning_tokens":0},"total_tokens":1747},"user":null},"returned_model":"gpt-5.6-terra","sdk_version":"3.6.0","total_tokens":1747,"usage_raw":{"compute_units":null,"input_tokens":1638,"input_tokens_details":{"cache_write_tokens":1635,"cached_tokens":0},"output_tokens":109,"output_tokens_details":{"reasoning_tokens":0},"total_tokens":1747}},"response_path":"request_journal/0396.attempt-1.response.json"}],"raw_attempts":["{\"predicted_label\":\"CLS-ZOGAA\",\"abstain\":false,\"used_insight_ids\":[],\"reasoning_summary\":\"Il caso coincide con gli esempi CLS-ZOGAA nel persistente spostamento positivo di XMEAS-1 in 8/8 finestre, nelle pendenze intermittenti e nell'elevata dispersione su XMEAS-1. Le differenze minori nelle conte di residual/diff non alterano il profilo dominante.\"}"],"raw_output":"{\"predicted_label\":\"CLS-ZOGAA\",\"abstain\":false,\"used_insight_ids\":[],\"reasoning_summary\":\"Il caso coincide con gli esempi CLS-ZOGAA nel persistente spostamento positivo di XMEAS-1 in 8/8 finestre, nelle pendenze intermittenti e nell'elevata dispersione su XMEAS-1. Le differenze minori nelle conte di residual/diff non alterano il profilo dominante.\"}","reasoning_effort":"medium","repetition":1,"requested_model":"gpt-5.6-terra","retry_count":0,"returned_model":"gpt-5.6-terra","seed":null,"sequence_index":396,"stateless":true,"store":false,"structural_validation_errors":[],"structured_outputs_strict":true,"temperature":null,"timestamp":"2026-09-04T14:14:56.137081+00:00","total_tokens":1747}
