{"agent_id":"agent_3","available_insight_ids":["INS-001","INS-002","INS-003","INS-004","INS-007","INS-008"],"block_index":55,"condition":"B","cumulative_input_tokens":2134,"cumulative_output_tokens":82,"cumulative_total_tokens":2216,"input_hash":"e15feba8fb66cec3f4fa6898a2601bb5eb65f2196615d17f7a921f0cf59f0b21","input_tokens":2134,"max_output_tokens":512,"max_structural_retries":2,"output_tokens":82,"parse_failure":false,"parsed_final_output":{"abstain":false,"predicted_label":"Normal","reasoning_summary":"Nessuna soglia di spostamento, pendenza, variabilità residua o variazioni campione-campione è superata. Il profilo coincide con l'esempio normale senza superamenti (EXM-010).","used_insight_ids":[]},"physical_case_id":"EXP3V2-N-005","position_in_block":1,"previous_response_id_used":false,"prompt_character_count":6804,"prompt_hash":"58b970c97ac2e3e4caadf1a9fe505e53e62f7b38e5eb229c83df5ee027cd363e","provider_attempts":[{"attempt":1,"intent_path":"request_journal/0165.attempt-1.intent.json","response":{"api_family":"Responses API","endpoint":"/v1/responses","input_tokens":2134,"output_tokens":82,"raw_output":"{\"predicted_label\":\"Normal\",\"abstain\":false,\"used_insight_ids\":[],\"reasoning_summary\":\"Nessuna soglia di spostamento, pendenza, variabilità residua o variazioni campione-campione è superata. Il profilo coincide con l'esempio normale senza superamenti (EXM-010).\"}","request_id":"req_e62e64f0243f470696256eab3aab272e","requested_model":"gpt-5.6-terra","response_id":"resp_0b9ea4d3081ece6e016a9acf9763a887d2ad1cb8a3c39e8562","response_raw":{"background":false,"billing":{"payer":"developer"},"completed_at":1788530585.0,"conversation":null,"created_at":1788530583.0,"error":null,"frequency_penalty":0.0,"id":"resp_0b9ea4d3081ece6e016a9acf9763a887d2ad1cb8a3c39e8562","incomplete_details":null,"instructions":null,"max_output_tokens":512,"max_tool_calls":null,"metadata":{},"model":"gpt-5.6-terra","moderation":null,"object":"response","output":[{"content":[{"annotations":[],"logprobs":[],"text":"{\"predicted_label\":\"Normal\",\"abstain\":false,\"used_insight_ids\":[],\"reasoning_summary\":\"Nessuna soglia di spostamento, pendenza, variabilità residua o variazioni campione-campione è superata. Il profilo coincide con l'esempio normale senza superamenti (EXM-010).\"}","type":"output_text"}],"id":"msg_0b9ea4d3081ece6e016a9acf98207c87d291317e30004ec822","phase":"final_answer","role":"assistant","status":"completed","type":"message"}],"parallel_tool_calls":true,"presence_penalty":0.0,"previous_response_id":null,"prompt":null,"prompt_cache_key":null,"prompt_cache_options":null,"prompt_cache_retention":"24h","reasoning":{"context":"all_turns","effort":"medium","generate_summary":null,"mode":"standard","summary":null},"safety_identifier":null,"service_tier":"default","status":"completed","store":false,"temperature":1.0,"text":{"format":{"description":null,"name":"phase_b_diagnostic_output","schema_":{"additionalProperties":false,"properties":{"abstain":{"type":"boolean"},"predicted_label":{"type":["string","null"]},"reasoning_summary":{"minLength":1,"type":"string"},"used_insight_ids":{"items":{"type":"string"},"type":"array"}},"required":["predicted_label","abstain","used_insight_ids","reasoning_summary"],"title":"Phase B diagnostic output (OpenAI Structured Outputs)","type":"object"},"strict":true,"type":"json_schema"},"verbosity":"medium"},"tool_choice":"auto","tool_usage":{"image_gen":{"input_tokens":0,"input_tokens_details":{"image_tokens":0,"text_tokens":0},"output_tokens":0,"output_tokens_details":{"image_tokens":0,"text_tokens":0},"total_tokens":0},"web_search":{"num_requests":0}},"tools":[],"top_logprobs":0,"top_p":0.98,"truncation":"disabled","usage":{"compute_units":null,"input_tokens":2134,"input_tokens_details":{"cache_write_tokens":0,"cached_tokens":2131},"output_tokens":82,"output_tokens_details":{"reasoning_tokens":0},"total_tokens":2216},"user":null},"returned_model":"gpt-5.6-terra","sdk_version":"3.6.0","total_tokens":2216,"usage_raw":{"compute_units":null,"input_tokens":2134,"input_tokens_details":{"cache_write_tokens":0,"cached_tokens":2131},"output_tokens":82,"output_tokens_details":{"reasoning_tokens":0},"total_tokens":2216}},"response_path":"request_journal/0165.attempt-1.response.json"}],"raw_attempts":["{\"predicted_label\":\"Normal\",\"abstain\":false,\"used_insight_ids\":[],\"reasoning_summary\":\"Nessuna soglia di spostamento, pendenza, variabilità residua o variazioni campione-campione è superata. Il profilo coincide con l'esempio normale senza superamenti (EXM-010).\"}"],"raw_output":"{\"predicted_label\":\"Normal\",\"abstain\":false,\"used_insight_ids\":[],\"reasoning_summary\":\"Nessuna soglia di spostamento, pendenza, variabilità residua o variazioni campione-campione è superata. Il profilo coincide con l'esempio normale senza superamenti (EXM-010).\"}","reasoning_effort":"medium","repetition":2,"requested_model":"gpt-5.6-terra","retry_count":0,"returned_model":"gpt-5.6-terra","seed":null,"sequence_index":165,"stateless":true,"store":false,"structural_validation_errors":[],"structured_outputs_strict":true,"temperature":null,"timestamp":"2026-09-04T14:03:05.464324+00:00","total_tokens":2216}
