{"agent_id":"agent_2","available_insight_ids":["INS-001","INS-002","INS-005","INS-006","INS-007","INS-008"],"block_index":184,"condition":"E","cumulative_input_tokens":2345,"cumulative_output_tokens":254,"cumulative_total_tokens":2599,"input_hash":"72f87789fbdc41f6b1e807367fd8cce5dcf1dcca10b46a5ec62cec0cb5b8a899","input_tokens":2345,"max_output_tokens":512,"max_structural_retries":2,"output_tokens":254,"parse_failure":false,"parsed_final_output":{"abstain":false,"predicted_label":"CLS-OJNSG","reasoning_summary":"Il caso è più simile agli esempi CLS-OJNSG: spostamento persistente e a segno non coerente su XMEAS-1, variabilità residua continua su XMEAS-10 e dispersione massima su XMEAS-1. Non presenta le firme specifiche riportate per CLS-R463B, CLS-Z3ISU o CLS-ZOGAA.","used_insight_ids":[]},"physical_case_id":"EXP3V2-F8-004","position_in_block":2,"previous_response_id_used":false,"prompt_character_count":7309,"prompt_hash":"f1aa8cb6326d1ac2e3fc7a5b364cf49f1fa6d1ed1d2fcfbc4dae4e640f7ff773","provider_attempts":[{"attempt":1,"intent_path":"request_journal/0553.attempt-1.intent.json","response":{"api_family":"Responses API","endpoint":"/v1/responses","input_tokens":2345,"output_tokens":254,"raw_output":"{\"predicted_label\":\"CLS-OJNSG\",\"abstain\":false,\"used_insight_ids\":[],\"reasoning_summary\":\"Il caso è più simile agli esempi CLS-OJNSG: spostamento persistente e a segno non coerente su XMEAS-1, variabilità residua continua su XMEAS-10 e dispersione massima su XMEAS-1. Non presenta le firme specifiche riportate per CLS-R463B, CLS-Z3ISU o CLS-ZOGAA.\"}","request_id":"req_75a29740682e489ba6951f6a4896b243","requested_model":"gpt-5.6-terra","response_id":"resp_01020e5c4a22a6ef016a9ad513b30087d2b4db45d10c5bd7d9","response_raw":{"background":false,"billing":{"payer":"developer"},"completed_at":1788531991.0,"conversation":null,"created_at":1788531987.0,"error":null,"frequency_penalty":0.0,"id":"resp_01020e5c4a22a6ef016a9ad513b30087d2b4db45d10c5bd7d9","incomplete_details":null,"instructions":null,"max_output_tokens":512,"max_tool_calls":null,"metadata":{},"model":"gpt-5.6-terra","moderation":null,"object":"response","output":[{"content":[],"encrypted_content":"gAAAAABqmtUXg3poPQScpzbCGIfmxyuyfPuXzeo9umRrjq8NVGlBmH40n4lsuTcyi6c6sudeIt7Z71KJEHQU4ANF9_ljRD2i9FoNv-6aSPXHTdyiJznb0YBaPbpcvmiEiV3yAE9hncsBnV91he-QarPv9XhvnEA_Xn2guROUMfuj3eLOY4jW6ydk9-Mb7LlZ3GobjWicOO3zQrHgRXWdF99tpjaufmEmjTrJJkg0QJKBsMYz04X51AChwKZdM6xZW5NagxKs-n1ImSGNezUxNTRu5-hpqsHwXLwzex0DRyIKmngeAzRGlhHcZbx-02z44oHXd4SPwwxcEkMSeFVIg4OM0ONbXf0Im_j2vHxdsgLA35WLhQDXBd_3uLbt9WdAMlYLobegWucSuCdaY5ipOmKCrwdgZML6IYCTnPrjhNfgA0Hp36aOgoXsrSZ7C-NP4TCXMk5OCKZqAwLxoy4CP4KI1p5k24uIXTGBHe9dCnWDlQBuaPVS-RWPQiJ4BDt3rORLuyw5vKwRnJImbgl83i4mVqemIkCvKlcO1AhyMKo7UZ9zISWOxtoIfbtKwDIj88wreE0_ztLhCZuxyuBSQc4LBqPdjcH4UlgEGK_xqXj2SOqlCx9t5JkUu_i5sK4lBdFhiNe0w57QYKs-i6B6CfzaG35SIoCjCKlE_DA8deDBInOc1uBmgBgpgvJaHSKUyPHE_mUokGnI4xwhQlGljw0CVbRWyQUBTY9ge6bpGfzLGA3jNKCv8EbjVTjMRxOPRGIFUDRZJOnYy-IZ_bH7IplwnwzbFkXeeroK3H2h0J9HebKwPSKqV14piUlBHOhRNUxa48aTbUjTkba6N3QIxpt3G3R6V6FLl-h6_9_F-IA9jFAMvsf0LznZPDmMC689FW00UplUKhuBzY2POC_bKscQOh86kNB4AwMGjn_ZZmhC952dH7oO-lyeQ2ATmerqPvSAN6GRRylhDXHgV2YJZNpQsKl3rOIwxfKIR8ATtpbv1XnO9zwI2Lxp8LO3dJpAJRD3pz9absaCuTKc2_35CneY2Nsgl0hJ8Q6tKm9KdHAF8cv15sAbJccQ1iemzXfQYiDMuQuMQSgVBGMVBP7GhlHm0Rnt0k2VcuyBvL_rVrSLFXQJ-FulGK0OYWRpbVnhScBO-E-IeMYOMeiHivt-x-QFBdvT0Bi1dc3A9_fnSa0eBQdqUqyPveu5w7zSwQ4o8ULP6-Zs7kF2_tskXC1Z7r89k3qDtCjrvogcd_8M7bl-kOcxTAsL0xh7Tje28a0u9OG4iD9npyPe2XN4b-x_Rn8V-MysdIgxpSMb2HYY1LZpsdrL2X9sBzK20-Z7USTKMjRn3XZq6u1uHxMGySyZRMvL-XAosAw9do6qyq91p7WrM9Iji1A7IzcXCCoEbvzHM51psBbPmhBRPJQyUVJUEJUQkKuaOV_NBQPZLPmoC1IfvbceADPAEMPkI9rwykClAuLbUtn-fie19qIkVIPMM4teazQF2sIvfU06VWx1hs4n8gRDfLQno0I06ZN-pVfDHsONKF7MP3swRHNHmZTa-t_zMVFZ0ffxDjobyg12OvvGo53Kho8lsVZsHu1Uj400Thaxrx_HLNqq3ET_xmAHT_TZNUxgvTXdbzUEmyeB47Kq6ydEdJyNHxlRI-NCVFnnz7aqVjYy6GP_hTivLPYCspD3smTzKjjPcwmZJtgtsR6ZRm4ohdm7jV99_ezZkmBe5nFmUYmPzK43os68l-sRSpHbV1j8pflVVoy67E6mMoA6RjqbTyoxWx4=","id":"rs_01020e5c4a22a6ef016a9ad514587087d29aa75cae1800c0f6","status":null,"summary":[],"type":"reasoning"},{"content":[{"annotations":[],"logprobs":[],"text":"{\"predicted_label\":\"CLS-OJNSG\",\"abstain\":false,\"used_insight_ids\":[],\"reasoning_summary\":\"Il caso è più simile agli esempi CLS-OJNSG: spostamento persistente e a segno non coerente su XMEAS-1, variabilità residua continua su XMEAS-10 e dispersione massima su XMEAS-1. Non presenta le firme specifiche riportate per CLS-R463B, CLS-Z3ISU o CLS-ZOGAA.\"}","type":"output_text"}],"id":"msg_01020e5c4a22a6ef016a9ad515d07c87d2a13916cd0fe5d435","phase":"final_answer","role":"assistant","status":"completed","type":"message"}],"parallel_tool_calls":true,"presence_penalty":0.0,"previous_response_id":null,"prompt":null,"prompt_cache_key":null,"prompt_cache_options":null,"prompt_cache_retention":"24h","reasoning":{"context":"all_turns","effort":"medium","generate_summary":null,"mode":"standard","summary":null},"safety_identifier":null,"service_tier":"default","status":"completed","store":false,"temperature":1.0,"text":{"format":{"description":null,"name":"phase_b_diagnostic_output","schema_":{"additionalProperties":false,"properties":{"abstain":{"type":"boolean"},"predicted_label":{"type":["string","null"]},"reasoning_summary":{"minLength":1,"type":"string"},"used_insight_ids":{"items":{"type":"string"},"type":"array"}},"required":["predicted_label","abstain","used_insight_ids","reasoning_summary"],"title":"Phase B diagnostic output (OpenAI Structured Outputs)","type":"object"},"strict":true,"type":"json_schema"},"verbosity":"medium"},"tool_choice":"auto","tool_usage":{"image_gen":{"input_tokens":0,"input_tokens_details":{"image_tokens":0,"text_tokens":0},"output_tokens":0,"output_tokens_details":{"image_tokens":0,"text_tokens":0},"total_tokens":0},"web_search":{"num_requests":0}},"tools":[],"top_logprobs":0,"top_p":0.98,"truncation":"disabled","usage":{"compute_units":null,"input_tokens":2345,"input_tokens_details":{"cache_write_tokens":0,"cached_tokens":2342},"output_tokens":254,"output_tokens_details":{"reasoning_tokens":131},"total_tokens":2599},"user":null},"returned_model":"gpt-5.6-terra","sdk_version":"3.6.0","total_tokens":2599,"usage_raw":{"compute_units":null,"input_tokens":2345,"input_tokens_details":{"cache_write_tokens":0,"cached_tokens":2342},"output_tokens":254,"output_tokens_details":{"reasoning_tokens":131},"total_tokens":2599}},"response_path":"request_journal/0553.attempt-1.response.json"}],"raw_attempts":["{\"predicted_label\":\"CLS-OJNSG\",\"abstain\":false,\"used_insight_ids\":[],\"reasoning_summary\":\"Il caso è più simile agli esempi CLS-OJNSG: spostamento persistente e a segno non coerente su XMEAS-1, variabilità residua continua su XMEAS-10 e dispersione massima su XMEAS-1. Non presenta le firme specifiche riportate per CLS-R463B, CLS-Z3ISU o CLS-ZOGAA.\"}"],"raw_output":"{\"predicted_label\":\"CLS-OJNSG\",\"abstain\":false,\"used_insight_ids\":[],\"reasoning_summary\":\"Il caso è più simile agli esempi CLS-OJNSG: spostamento persistente e a segno non coerente su XMEAS-1, variabilità residua continua su XMEAS-10 e dispersione massima su XMEAS-1. Non presenta le firme specifiche riportate per CLS-R463B, CLS-Z3ISU o CLS-ZOGAA.\"}","reasoning_effort":"medium","repetition":2,"requested_model":"gpt-5.6-terra","retry_count":0,"returned_model":"gpt-5.6-terra","seed":null,"sequence_index":553,"stateless":true,"store":false,"structural_validation_errors":[],"structured_outputs_strict":true,"temperature":null,"timestamp":"2026-09-04T14:26:31.574145+00:00","total_tokens":2599}
