{"agent_id":"agent_4","available_insight_ids":["INS-001","INS-002","INS-003","INS-004","INS-005","INS-006"],"block_index":95,"condition":"E","cumulative_input_tokens":2337,"cumulative_output_tokens":113,"cumulative_total_tokens":2450,"input_hash":"216f2325672e2e7276af4dd8a91e699b3b86f8f8da9cff70155d5c88bbd5bc77","input_tokens":2337,"max_output_tokens":512,"max_structural_retries":2,"output_tokens":113,"parse_failure":false,"parsed_final_output":{"abstain":false,"predicted_label":"CLS-OJNSG","reasoning_summary":"Il caso coincide con il pattern CLS-OJNSG: XMEAS-1 mostra spostamento positivo persistente 8/8 con massima dispersione, mentre XMEAS-20 residuale e XMEAS-10 diff/joint presentano le stesse frequenze e distribuzione temporale riportate.","used_insight_ids":["INS-001","INS-002"]},"physical_case_id":"EXP3V2-F1-002","position_in_block":1,"previous_response_id_used":false,"prompt_character_count":7316,"prompt_hash":"a1886e76ceae9a8a6673938205b18e8368af5bccd164fa3a7d3cfba4a585ddad","provider_attempts":[{"attempt":1,"intent_path":"request_journal/0285.attempt-1.intent.json","response":{"api_family":"Responses API","endpoint":"/v1/responses","input_tokens":2337,"output_tokens":113,"raw_output":"{\"predicted_label\":\"CLS-OJNSG\",\"abstain\":false,\"used_insight_ids\":[\"INS-001\",\"INS-002\"],\"reasoning_summary\":\"Il caso coincide con il pattern CLS-OJNSG: XMEAS-1 mostra spostamento positivo persistente 8/8 con massima dispersione, mentre XMEAS-20 residuale e XMEAS-10 diff/joint presentano le stesse frequenze e distribuzione temporale riportate.\"}","request_id":"req_b16e352e300a4c4899fd6e3882235a3a","requested_model":"gpt-5.6-terra","response_id":"resp_01ff2efee6f5806a016a9ad0ef6c0087d2abcc0e905d7c60ef","response_raw":{"background":false,"billing":{"payer":"developer"},"completed_at":1788530929.0,"conversation":null,"created_at":1788530927.0,"error":null,"frequency_penalty":0.0,"id":"resp_01ff2efee6f5806a016a9ad0ef6c0087d2abcc0e905d7c60ef","incomplete_details":null,"instructions":null,"max_output_tokens":512,"max_tool_calls":null,"metadata":{},"model":"gpt-5.6-terra","moderation":null,"object":"response","output":[{"content":[{"annotations":[],"logprobs":[],"text":"{\"predicted_label\":\"CLS-OJNSG\",\"abstain\":false,\"used_insight_ids\":[\"INS-001\",\"INS-002\"],\"reasoning_summary\":\"Il caso coincide con il pattern CLS-OJNSG: XMEAS-1 mostra spostamento positivo persistente 8/8 con massima dispersione, mentre XMEAS-20 residuale e XMEAS-10 diff/joint presentano le stesse frequenze e distribuzione temporale riportate.\"}","type":"output_text"}],"id":"msg_01ff2efee6f5806a016a9ad0f033dc87d2abacd48c5fe3c4a3","phase":"final_answer","role":"assistant","status":"completed","type":"message"}],"parallel_tool_calls":true,"presence_penalty":0.0,"previous_response_id":null,"prompt":null,"prompt_cache_key":null,"prompt_cache_options":null,"prompt_cache_retention":"24h","reasoning":{"context":"all_turns","effort":"medium","generate_summary":null,"mode":"standard","summary":null},"safety_identifier":null,"service_tier":"default","status":"completed","store":false,"temperature":1.0,"text":{"format":{"description":null,"name":"phase_b_diagnostic_output","schema_":{"additionalProperties":false,"properties":{"abstain":{"type":"boolean"},"predicted_label":{"type":["string","null"]},"reasoning_summary":{"minLength":1,"type":"string"},"used_insight_ids":{"items":{"type":"string"},"type":"array"}},"required":["predicted_label","abstain","used_insight_ids","reasoning_summary"],"title":"Phase B diagnostic output (OpenAI Structured Outputs)","type":"object"},"strict":true,"type":"json_schema"},"verbosity":"medium"},"tool_choice":"auto","tool_usage":{"image_gen":{"input_tokens":0,"input_tokens_details":{"image_tokens":0,"text_tokens":0},"output_tokens":0,"output_tokens_details":{"image_tokens":0,"text_tokens":0},"total_tokens":0},"web_search":{"num_requests":0}},"tools":[],"top_logprobs":0,"top_p":0.98,"truncation":"disabled","usage":{"compute_units":null,"input_tokens":2337,"input_tokens_details":{"cache_write_tokens":0,"cached_tokens":2334},"output_tokens":113,"output_tokens_details":{"reasoning_tokens":0},"total_tokens":2450},"user":null},"returned_model":"gpt-5.6-terra","sdk_version":"3.6.0","total_tokens":2450,"usage_raw":{"compute_units":null,"input_tokens":2337,"input_tokens_details":{"cache_write_tokens":0,"cached_tokens":2334},"output_tokens":113,"output_tokens_details":{"reasoning_tokens":0},"total_tokens":2450}},"response_path":"request_journal/0285.attempt-1.response.json"}],"raw_attempts":["{\"predicted_label\":\"CLS-OJNSG\",\"abstain\":false,\"used_insight_ids\":[\"INS-001\",\"INS-002\"],\"reasoning_summary\":\"Il caso coincide con il pattern CLS-OJNSG: XMEAS-1 mostra spostamento positivo persistente 8/8 con massima dispersione, mentre XMEAS-20 residuale e XMEAS-10 diff/joint presentano le stesse frequenze e distribuzione temporale riportate.\"}"],"raw_output":"{\"predicted_label\":\"CLS-OJNSG\",\"abstain\":false,\"used_insight_ids\":[\"INS-001\",\"INS-002\"],\"reasoning_summary\":\"Il caso coincide con il pattern CLS-OJNSG: XMEAS-1 mostra spostamento positivo persistente 8/8 con massima dispersione, mentre XMEAS-20 residuale e XMEAS-10 diff/joint presentano le stesse frequenze e distribuzione temporale riportate.\"}","reasoning_effort":"medium","repetition":3,"requested_model":"gpt-5.6-terra","retry_count":0,"returned_model":"gpt-5.6-terra","seed":null,"sequence_index":285,"stateless":true,"store":false,"structural_validation_errors":[],"structured_outputs_strict":true,"temperature":null,"timestamp":"2026-09-04T14:08:49.722612+00:00","total_tokens":2450}
